{
  "id": "minimax-h3-i2v-8step",
  "version": 1,
  "capability": "video.image2video",
  "runner": "comfyui",
  "displayName": "MiniMax H3 首末帧生成视频（8 步平衡档）",
  "description": "i2v 平衡档模板：fl2va base + fl2v 8 步 768p LoRA，shift 6/3 + euler + longSide 1344。",
  "output": {
    "mediaType": "video",
    "hasAudio": true
  },
  "modelNode": "1",
  "assets": {
    "unet": {
      "kind": "checkpoint",
      "default": "minimax_h3_fl2va_pruned_int8_convrot.safetensors",
      "env": "DSH_SVS_H3_MODEL_FL",
      "label": "H3 FL2VA UNet"
    },
    "clip": {
      "kind": "clip",
      "default": "qwen3vl_32b_minimax_h3_nvfp4_awq.safetensors",
      "env": "DSH_SVS_H3_CLIP",
      "label": "H3 CLIP"
    },
    "vae": {
      "kind": "vae",
      "default": "minimax_h3_video_vae_fp16.safetensors",
      "env": "DSH_SVS_H3_VAE",
      "label": "H3 视频 VAE（int8_convrot 为可选加速件，经配置/assetOverrides 切换）"
    },
    "audio_vae": {
      "kind": "vae",
      "default": "minimax_h3_audio_vae_fp32.safetensors",
      "env": "DSH_SVS_H3_AUDIO_VAE",
      "label": "H3 音频 VAE"
    },
    "lora_8step": {
      "kind": "lora",
      "default": "minimax_h3_fl2v_turbo_8step_v1.0_768p_comfyui_bf16.safetensors",
      "env": "DSH_SVS_H3_LORA_FL_8STEP",
      "label": "H3 fl2v 8 步平衡档 LoRA（768p，shift 6/3）"
    }
  },
  "graph": {
    "1": {
      "class_type": "UNETLoader",
      "inputs": {
        "unet_name": "$assets.unet",
        "weight_dtype": "default"
      }
    },
    "3": {
      "class_type": "CLIPLoader",
      "inputs": {
        "clip_name": "$assets.clip",
        "type": "minimax"
      }
    },
    "4": {
      "class_type": "VAELoader",
      "inputs": {
        "vae_name": "$assets.vae"
      }
    },
    "4a": {
      "class_type": "VAELoader",
      "inputs": {
        "vae_name": "$assets.audio_vae"
      }
    },
    "2": {
      "class_type": "MiniMaxH3SigmaShift",
      "inputs": {
        "model": [
          "$model",
          0
        ],
        "shift_video": 6,
        "shift_audio": 3
      }
    },
    "5": {
      "class_type": "MiniMaxH3ImageToVideo",
      "inputs": {
        "clip": [
          "3",
          0
        ],
        "vae": [
          "4",
          0
        ],
        "prompt": null,
        "width": null,
        "height": null,
        "length": null
      }
    },
    "6": {
      "class_type": "RandomNoise",
      "inputs": {
        "noise_seed": null
      }
    },
    "7": {
      "class_type": "BasicGuider",
      "inputs": {
        "model": [
          "2",
          0
        ],
        "conditioning": [
          "5",
          0
        ]
      }
    },
    "8": {
      "class_type": "KSamplerSelect",
      "inputs": {
        "sampler_name": "euler"
      }
    },
    "9": {
      "class_type": "BasicScheduler",
      "inputs": {
        "model": [
          "2",
          0
        ],
        "scheduler": "simple",
        "steps": null,
        "denoise": 1.0
      }
    },
    "10": {
      "class_type": "SamplerCustomAdvanced",
      "inputs": {
        "noise": [
          "6",
          0
        ],
        "guider": [
          "7",
          0
        ],
        "sampler": [
          "8",
          0
        ],
        "sigmas": [
          "9",
          0
        ],
        "latent_image": [
          "5",
          1
        ]
      }
    },
    "11": {
      "class_type": "VAEDecode",
      "inputs": {
        "samples": [
          "10",
          0
        ],
        "vae": [
          "4",
          0
        ]
      }
    },
    "11a": {
      "class_type": "VAEDecodeAudio",
      "inputs": {
        "samples": [
          "10",
          0
        ],
        "vae": [
          "4a",
          0
        ]
      }
    },
    "12": {
      "class_type": "CreateVideo",
      "inputs": {
        "images": [
          "11",
          0
        ],
        "audio": [
          "11a",
          0
        ],
        "fps": null
      }
    },
    "13": {
      "class_type": "SaveVideo",
      "inputs": {
        "video": [
          "12",
          0
        ],
        "filename_prefix": null,
        "format": "mp4",
        "codec": "h264"
      }
    }
  },
  "params": {
    "prompt": {
      "inject": "scalar",
      "to": {
        "node": "5",
        "field": "prompt"
      }
    },
    "width": {
      "inject": "scalar",
      "to": {
        "node": "5",
        "field": "width"
      }
    },
    "height": {
      "inject": "scalar",
      "to": {
        "node": "5",
        "field": "height"
      }
    },
    "length": {
      "inject": "scalar",
      "to": {
        "node": "5",
        "field": "length"
      }
    },
    "seed": {
      "inject": "scalar",
      "to": {
        "node": "6",
        "field": "noise_seed"
      }
    },
    "steps": {
      "inject": "scalar",
      "to": {
        "node": "9",
        "field": "steps"
      }
    },
    "fps": {
      "inject": "scalar",
      "to": {
        "node": "12",
        "field": "fps"
      },
      "default": 24
    },
    "first_frame": {
      "inject": "image",
      "via": "node",
      "node": "LoadImage",
      "to": {
        "node": "5",
        "field": "first_frame"
      },
      "preprocess": [
        {
          "class_type": "ImageScale",
          "inputs": {
            "upscale_method": "lanczos",
            "width": "${width}",
            "height": "${height}",
            "crop": "disabled"
          }
        }
      ]
    },
    "last_frame": {
      "inject": "image",
      "via": "node",
      "node": "LoadImage",
      "to": {
        "node": "5",
        "field": "last_frame"
      },
      "preprocess": [
        {
          "class_type": "ImageScale",
          "inputs": {
            "upscale_method": "lanczos",
            "width": "${width}",
            "height": "${height}",
            "crop": "disabled"
          }
        }
      ]
    },
    "prefix": {
      "inject": "scalar",
      "to": {
        "node": "13",
        "field": "filename_prefix"
      }
    }
  },
  "modes": {
    "balanced": {
      "steps": 8,
      "longSide": 1344,
      "loras": [
        {
          "asset": "lora_8step",
          "strength": 1
        }
      ]
    }
  },
  "resolution": {
    "policy": "aspect-ratio",
    "snap": 32,
    "default": {
      "fast": [
        832,
        480
      ],
      "quality": [
        1344,
        768
      ]
    }
  },
  "constraints": {
    "aspectRatios": [
      "16:9",
      "9:16",
      "1:1"
    ],
    "maxDurationFrames": 310,
    "supportsSubtitles": true
  }
}